{
  "scorecard_kind": "provider_eval_scorecard",
  "capability": "asr",
  "region": "cn",
  "vendor": "funasr_selfhost",
  "role": "primary",
  "status": "measured",
  "synthetic": true,
  "dimensions": {
    "performance": {
      "score": 95,
      "weight": 30,
      "evidence_ref": "reports/m2-local-round1.json#metrics.asr_final_ms（P95 856ms ≤ 1000ms）",
      "status": "measured"
    },
    "quality": {
      "score": 85,
      "weight": 25,
      "evidence_ref": "reports/m2-local-round1.json#metrics.asr_similarity_avg（0.965）",
      "status": "desk_research"
    },
    "compliance": {
      "score": 90,
      "weight": 15,
      "evidence_ref": "docs/decisions/OD-01-provider-evaluation.md（数据自持、本地推理）",
      "status": "desk_research"
    },
    "licensing": {
      "score": 80,
      "weight": 10,
      "evidence_ref": "ModelScope iic/SenseVoiceSmall 模型协议（商用需按协议登记）",
      "status": "desk_research"
    },
    "replaceability": {
      "score": 90,
      "weight": 10,
      "evidence_ref": "services/asr Provider 契约可切换 whisper/商业 API",
      "status": "desk_research"
    },
    "cost": {
      "score": 95,
      "weight": 10,
      "evidence_ref": "本地 CPU 推理，零 API 费用",
      "status": "desk_research"
    }
  },
  "score": 89.8,
  "red_lines": [],
  "metrics": {
    "asr_final": {
      "n": 10,
      "p50": 404.5,
      "p95": 855.5,
      "p99": 879.5
    }
  },
  "samples_ref": "ai\\evals\\providers\\samples\\asr_cn_funasr_selfhost.jsonl",
  "measured_at": "2026-08-04",
  "measured_by": "项目负责人/AI 负责人（建议分，待三方签字）"
}
